{
  "type": "odor_sample",
  "version": "0.2",
  "stamp": "2026-10-10T05:12:33.120Z",
  "device_id": "octo_01",
  "drone": {
    "stamp": "2026-10-10T05:12:33.080Z",
    "device_id": "octo_01",
    "armed": true,
    "mode": "AUTO",
    "in_air": true,
    "latitude": 35.8243715,
    "longitude": 127.1486021,
    "altitude_msl": 60.2,
    "altitude_rel": 20.1,
    "heading_deg": 87.5,
    "gps_fix_type": 3,
    "gps_satellites": 15,
    "roll_deg": 1.2,
    "pitch_deg": -2.3,
    "yaw_deg": 2.5,
    "ground_speed_mps": 3.1,
    "climb_rate_mps": 0.0,
    "battery_voltage": 23.4,
    "battery_current": 41.2,
    "battery_percent": 78.0
  },
  "gas": {
    "stamp": "2026-10-10T05:12:33.120Z",
    "device_id": "mob_01",
    "h2s_ppm": 0.021,
    "nh3_ppm": 0.83,
    "tvoc_ppb": 240.0,
    "temperature_c": 23.1,
    "humidity_pct": 58.4,
    "pump_on": false,
    "payload_voltage": null,
    "eco2_ppm": 520.0,
    "voc_index": null,
    "nox_index": null,
    "pressure_hpa": 1008.4,
    "gas_resistance_ohm": 52300.0,
    "pm1_0_ugm3": null,
    "pm2_5_ugm3": null,
    "pm10_ugm3": null,
    "nh3_raw": 0.7,
    "h2s_raw": 0.02,
    "flags": 1024
  },
  "drone_age_s": 0.04
}
